headline,url
Certains Afghans pourront être renvoyés de Suisse dès mi-avril,https://www.20min.ch/fr/story/suisse-certains-afghans-pourront-etre-renvoyes-de-suisse-des-mi-avril-103307053
Le National a rejeté l'initiative «Pour un service citoyen»,https://www.20min.ch/fr/story/parlement-le-national-met-une-gifle-a-l-initiative-pour-un-service-citoyen-103305846
L'initiative pour taxer l'héritage des «ultrariches» balayée,https://www.20min.ch/fr/story/conseil-national-l-initiative-pour-taxer-l-heritage-des-ultra-riches-balayee-103305577
Parlement: «Le PLR en a assez de cette chasse aux riches!»,https://www.20min.ch/fr/story/impot-sur-l-heritage-parlement-le-plr-en-a-assez-de-cette-chasse-aux-riches-103295914
"Les Jeunes Vert-e-x-s n'ont convaincu qu'à gauche, et encore",https://www.20min.ch/fr/story/votation-du-9-fevrier-les-jeunes-vert-e-x-s-n-ont-convaincu-qu-a-gauche-et-encore-103277667
