headline,url
Quelle star soutient qui aux États-Unis?,https://www.20min.ch/fr/story/presidentielle-americaine-quelle-star-soutient-qui-aux-etats-unis-103202286
Donald Trump et Kamala Harris font campagne dans le même État-clé,https://www.20min.ch/fr/story/onde-de-choc-a-washington-joe-biden-jette-l-eponge-et-roulera-pour-kamala-harris-103153464
"«Winner-takes-all», comment marche le vote aux États-Unis",https://www.20min.ch/fr/story/presidentielle-americaine-winner-takes-all-comment-marche-le-vote-aux-etats-unis-103199023
"Kamala Harris plébiscitée en Suisse, même au sein de la droite",https://www.20min.ch/fr/story/presidentielle-americaine-2024-kamala-harris-plebiscitee-en-suisse-meme-au-sein-de-la-droite-103204189
"Harris sillonne le Wisconsin, Trump s’appuie sur Musk",https://www.20min.ch/fr/story/presidentielle-americaine-harris-sillonne-le-wisconsin-trump-s-appuie-sur-musk-103204125
