headline,url
Tout savoir sur les révisions du droit du bail,https://www.20min.ch/fr/video/votations-du-24-novembre-tout-savoir-sur-les-revisions-du-droit-du-bail-103220398
Tout savoir sur le projet d’extension des autoroutes,https://www.20min.ch/fr/video/votations-du-24-novembre-tout-savoir-sur-le-projet-d-extension-des-autoroutes-103220384
Les enjeux du financement uniforme des soins,https://www.20min.ch/fr/video/votations-du-24-novembre-les-enjeux-du-financement-uniforme-des-soins-103220391
"Autoroutes, locataires, coûts de la santé: le menu du vote",https://www.20min.ch/fr/story/votation-du-24-novembre-autoroutes-locataires-couts-de-la-sante-le-menu-du-vote-103205941
"Passerelle du Mont-Blanc: la Ville a fait faux, mais on votera",https://www.20min.ch/fr/story/votations-a-geneve-passerelle-du-mont-blanc-la-ville-a-fait-faux-mais-on-votera-103225119
